{
  "$schema": "https://json-schema.org/draft/2020-12/schema",
  "$id": "index.schema.json",
  "title": "빅 히스토리 연표 매니페스트",
  "description": "data/index.json. 어떤 데이터 파일이 존재하고 각각 어떤 트랙/카테고리/표시이름/색상에 속하는지 등록한다.",
  "type": "object",
  "required": ["schema_version", "tracks", "datasets", "eras"],
  "additionalProperties": false,
  "properties": {
    "$schema": { "type": "string" },
    "schema_version": { "type": "integer", "minimum": 1 },
    "title": { "type": "string" },
    "description": { "type": "string" },
    "tracks": {
      "type": "array",
      "minItems": 1,
      "items": {
        "type": "object",
        "required": ["id", "label"],
        "additionalProperties": false,
        "properties": {
          "id": { "type": "string", "pattern": "^[a-z0-9][a-z0-9-]*$" },
          "label": { "type": "string", "minLength": 1 },
          "order": { "type": "integer" }
        }
      }
    },
    "eras": {
      "type": "array",
      "description": "연표를 나누는 시대 구간. 화면의 시대 칩·섹션·배경 팔레트가 모두 여기서 만들어진다.",
      "minItems": 1,
      "items": {
        "type": "object",
        "required": ["id", "label", "start_year", "end_year"],
        "additionalProperties": false,
        "properties": {
          "id": { "type": "string", "pattern": "^[a-z0-9][a-z0-9-]*$" },
          "label": { "type": "string", "minLength": 1 },
          "range": { "type": "string", "description": "칩·제목 옆에 표시할 연도 범위 문구" },
          "start_year": { "type": "integer" },
          "end_year": { "type": "integer" },
          "art": { "type": "string", "description": "이 시대 삽화의 의도(디오라마가 없을 때 라벨로 표시)" },
          "diorama": { "type": "string", "description": "시대 섹션 뒤에 깔리는 디오라마 그림 경로(art/*.svg). 좌우 레터박스에서 진하고 가운데는 흐려진다", "pattern": "^[A-Za-z0-9._/-]+\\.(svg|png|webp|jpg)$" },
          "scenes": {
            "type": "array",
            "description": "시대 안의 장면들(시작 연도 순). 장면마다 디오라마가 따로 깔리고, 연표를 내리면 장면이 바뀐다. 없으면 diorama 한 장이 시대 전체를 맡는다.",
            "items": {
              "type": "object",
              "required": ["id", "label", "start_year", "diorama"],
              "additionalProperties": false,
              "properties": {
                "id": { "type": "string", "pattern": "^[a-z0-9][a-z0-9-]*$" },
                "label": { "type": "string", "minLength": 1, "description": "계기판에 작게 나오는 장면 이름" },
                "start_year": { "type": "integer" },
                "diorama": { "type": "string", "pattern": "^[A-Za-z0-9._/-]+\\.(svg|png|webp|jpg)$" },
                "art": { "type": "string", "description": "그림 설명(대체 텍스트·작업 메모)" },
                "after": { "type": "string", "minLength": 1, "description": "명화 오마주라면 원작 표기(작가, 제목, 연도). 퍼블릭 도메인 작품만 — 설정 탭 '그림 출처'에 자동으로 나온다" }
              }
            }
          },
          "strip": { "type": "string", "description": "계기판 시대 띠에 쓰는 색", "pattern": "^#[0-9a-fA-F]{6}$" },
          "day": { "type": "array", "minItems": 2, "maxItems": 2, "items": { "type": "string" } },
          "day_blob": { "type": "array", "minItems": 2, "maxItems": 2, "items": { "type": "string" } },
          "night": { "type": "array", "minItems": 2, "maxItems": 2, "items": { "type": "string" } },
          "night_blob": { "type": "array", "minItems": 2, "maxItems": 2, "items": { "type": "string" } }
        }
      }
    },
    "datasets": {
      "type": "array",
      "minItems": 1,
      "description": "새 국가/카테고리 추가 = data/ 에 JSON 파일 하나 + 여기에 항목 하나 추가.",
      "items": {
        "type": "object",
        "required": ["id", "file", "track", "category", "subcategory", "label", "color"],
        "additionalProperties": false,
        "properties": {
          "id": { "type": "string", "pattern": "^[a-z0-9][a-z0-9-]*$" },
          "file": { "type": "string", "pattern": "^[A-Za-z0-9._-]+\\.json$" },
          "track": {
            "type": "string",
            "description": "tracks[].id 중 하나. 기본값은 nation(왕조·국가사) / theme(주제사).",
            "pattern": "^[a-z0-9][a-z0-9-]*$"
          },
          "category": { "type": "string", "minLength": 1 },
          "subcategory": { "type": "string", "minLength": 1 },
          "label": { "type": "string", "minLength": 1 },
          "color": { "type": "string", "pattern": "^#[0-9a-fA-F]{6}$" },
          "region": { "type": "string" },
          "order": { "type": "integer" },
          "hidden_by_default": { "type": "boolean" },
          "periods": {
            "type": "array",
            "description": "국가사의 시대 묶음(예: 삼국 시대, 송원 시대). 탐험 화면에서 열 왼쪽 띠에 세로로 적힌다. 시작 연도 순, 서로 겹치지 않게.",
            "items": {
              "type": "object",
              "required": ["label", "start_year", "end_year"],
              "additionalProperties": false,
              "properties": {
                "label": { "type": "string", "minLength": 1 },
                "start_year": { "type": "integer" },
                "end_year": { "type": "integer" },
                "note": { "type": "string", "description": "경계를 어디서 끊었는지 등 검토용 메모(화면에는 나오지 않음)" }
              }
            }
          }
        }
      }
    }
  }
}
