{
  "$schema": "../schema/index.schema.json",
  "schema_version": 1,
  "title": "빅 히스토리 연표",
  "description": "왕조·국가사와 주제사를 하나의 시간축 위에서 비교하는 통합 연표.",
  "eras": [
    {
      "id": "prehistory",
      "label": "선사",
      "range": "기원전 30000 – 기원전 3500",
      "start_year": -32000,
      "end_year": -3500,
      "art": "동굴 벽 앞의 모닥불 — 시로가 손을 쬔다",
      "day": [
        "#F3E4D2",
        "#E9D6BF"
      ],
      "day_blob": [
        "rgba(201,149,107,.45)",
        "rgba(140,106,79,.3)"
      ],
      "night": [
        "#241A1C",
        "#1C1724"
      ],
      "night_blob": [
        "rgba(140,106,79,.55)",
        "rgba(92,61,46,.5)"
      ],
      "diorama": "art/prehistory.svg",
      "strip": "#8C6A4F"
    },
    {
      "id": "ancient",
      "label": "고대",
      "range": "기원전 3500 – 500",
      "start_year": -3500,
      "end_year": 500,
      "art": "나일강 갈대밭과 피라미드 — 시로가 파피루스 배를 탄다",
      "day": [
        "#F7E9D0",
        "#F1DDB9"
      ],
      "day_blob": [
        "rgba(230,194,122,.5)",
        "rgba(176,138,74,.3)"
      ],
      "night": [
        "#262033",
        "#1C1724"
      ],
      "night_blob": [
        "rgba(176,138,74,.5)",
        "rgba(110,91,168,.3)"
      ],
      "diorama": "art/ancient.svg",
      "scenes": [
        {
          "id": "ancient-river",
          "label": "강가의 첫 문명",
          "start_year": -3500,
          "diorama": "art/ancient.svg",
          "art": "나일강 갈대밭과 피라미드 — 시로가 파피루스 배를 탄다"
        },
        {
          "id": "ancient-sea",
          "label": "지중해의 배와 글자",
          "start_year": -1200,
          "diorama": "art/ancient-sea.svg",
          "art": "갤리선과 항구 — 시로가 점토판에 글자를 새긴다"
        },
        {
          "id": "ancient-dice",
          "label": "주사위 놀이",
          "start_year": -550,
          "diorama": "art/homage-dice.svg",
          "art": "흑화 도기 속 두 토끼의 주사위 놀이",
          "after": "엑세키아스, 「주사위 놀이하는 아킬레우스와 아이아스」 흑화 암포라, 기원전 530년경"
        },
        {
          "id": "ancient-terracotta",
          "label": "병마용",
          "start_year": -250,
          "diorama": "art/homage-terracotta.svg",
          "art": "줄지어 선 흙빛 토끼 병사들",
          "after": "진시황릉 병마용, 기원전 210년경"
        },
        {
          "id": "ancient-road",
          "label": "제국의 길",
          "start_year": 0,
          "diorama": "art/ancient-road.svg",
          "art": "수도교와 만리장성 — 시로가 낙타를 타고 실크로드를 건넌다"
        },
        {
          "id": "ancient-dance",
          "label": "무용총 춤",
          "start_year": 250,
          "diorama": "art/homage-dance.svg",
          "art": "물방울무늬 옷에 긴 소매를 날리며 춤추는 토끼들",
          "after": "고구려 무용총 「무용도」 벽화, 5세기"
        }
      ],
      "strip": "#B08A4A"
    },
    {
      "id": "medieval",
      "label": "중세",
      "range": "500 – 1400",
      "start_year": 500,
      "end_year": 1400,
      "art": "안개 낀 숲과 성탑 — 시로가 등불을 든다",
      "day": [
        "#E8EDE3",
        "#D9E3D6"
      ],
      "day_blob": [
        "rgba(127,166,143,.45)",
        "rgba(79,122,106,.3)"
      ],
      "night": [
        "#1D2628",
        "#1C1724"
      ],
      "night_blob": [
        "rgba(79,122,106,.55)",
        "rgba(74,106,156,.3)"
      ],
      "diorama": "art/medieval.svg",
      "scenes": [
        {
          "id": "medieval-forest",
          "label": "숲과 성탑",
          "start_year": 500,
          "diorama": "art/medieval.svg",
          "art": "안개 낀 숲과 성탑 — 시로가 등불을 든다"
        },
        {
          "id": "medieval-qingming",
          "label": "청명상하도",
          "start_year": 1000,
          "diorama": "art/homage-qingming.svg",
          "art": "무지개다리를 건너는 토끼 인파와 강의 배",
          "after": "장택단, 「청명상하도」, 12세기"
        },
        {
          "id": "medieval-steppe",
          "label": "초원과 대상",
          "start_year": 1200,
          "diorama": "art/medieval-steppe.svg",
          "art": "초원의 게르와 말 — 시로가 말을 탄다"
        }
      ],
      "strip": "#4F7A6A"
    },
    {
      "id": "earlymodern",
      "label": "근세",
      "range": "1400 – 1760",
      "start_year": 1400,
      "end_year": 1760,
      "art": "수평선을 넘는 범선 — 시로가 돛대 위에서 망원경을 본다",
      "day": [
        "#E6ECF4",
        "#D6E1EE"
      ],
      "day_blob": [
        "rgba(109,143,194,.45)",
        "rgba(74,106,156,.3)"
      ],
      "night": [
        "#1B2234",
        "#1C1724"
      ],
      "night_blob": [
        "rgba(74,106,156,.6)",
        "rgba(79,122,106,.3)"
      ],
      "diorama": "art/earlymodern.svg",
      "scenes": [
        {
          "id": "earlymodern-sea",
          "label": "대항해",
          "start_year": 1400,
          "diorama": "art/earlymodern.svg",
          "art": "수평선을 넘는 범선 — 시로가 돛대 위에서 망원경을 본다"
        },
        {
          "id": "earlymodern-monalisa",
          "label": "모나리자",
          "start_year": 1500,
          "diorama": "art/homage-monalisa.svg",
          "art": "액자 속 토끼 초상과 이젤 앞 화가 토끼",
          "after": "레오나르도 다 빈치, 「모나리자」, 1503–1519년경"
        },
        {
          "id": "earlymodern-court",
          "label": "궁궐과 천문대",
          "start_year": 1600,
          "diorama": "art/earlymodern-court.svg",
          "art": "기와지붕 궁궐과 혼천의 — 시로가 별을 본다"
        },
        {
          "id": "earlymodern-pearl",
          "label": "진주 귀걸이",
          "start_year": 1660,
          "diorama": "art/homage-pearl.svg",
          "art": "파랑·노랑 터번을 쓴 토끼 초상",
          "after": "요하네스 페르메이르, 「진주 귀걸이를 한 소녀」, 1665년경"
        }
      ],
      "strip": "#4A6A9C"
    },
    {
      "id": "modern",
      "label": "근대",
      "range": "1760 – 1914",
      "start_year": 1760,
      "end_year": 1914,
      "art": "증기와 톱니바퀴의 부두 — 시로가 열기구를 탄다",
      "day": [
        "#F4E6E0",
        "#ECD8CF"
      ],
      "day_blob": [
        "rgba(201,133,111,.45)",
        "rgba(162,96,90,.3)"
      ],
      "night": [
        "#2A1E22",
        "#1C1724"
      ],
      "night_blob": [
        "rgba(162,96,90,.55)",
        "rgba(176,138,74,.3)"
      ],
      "diorama": "art/modern.svg",
      "scenes": [
        {
          "id": "modern-steam",
          "label": "증기와 톱니",
          "start_year": 1760,
          "diorama": "art/modern.svg",
          "art": "증기와 톱니바퀴의 부두 — 시로가 열기구를 탄다"
        },
        {
          "id": "modern-ssireum",
          "label": "씨름",
          "start_year": 1800,
          "diorama": "art/homage-ssireum.svg",
          "art": "둘러앉은 갓 쓴 토끼 구경꾼과 씨름하는 두 토끼",
          "after": "김홍도, 「씨름」(『단원풍속도첩』), 18세기 후반"
        },
        {
          "id": "modern-wave",
          "label": "큰 파도",
          "start_year": 1830,
          "diorama": "art/homage-wave.svg",
          "art": "거대한 파도 아래 배에 웅크린 토끼들과 후지산",
          "after": "가쓰시카 호쿠사이, 「가나가와 해변의 높은 파도 아래」, 1831년경"
        },
        {
          "id": "modern-rail",
          "label": "기차와 전신",
          "start_year": 1860,
          "diorama": "art/modern-rail.svg",
          "art": "증기기관차와 전신주 — 시로가 손을 흔든다"
        },
        {
          "id": "modern-starry",
          "label": "별이 빛나는 밤",
          "start_year": 1885,
          "diorama": "art/homage-starry.svg",
          "art": "소용돌이 하늘과 사이프러스, 하늘을 보는 토끼 둘",
          "after": "빈센트 반 고흐, 「별이 빛나는 밤」, 1889"
        }
      ],
      "strip": "#A2605A"
    },
    {
      "id": "contemporary",
      "label": "현대",
      "range": "1914 – 2025",
      "start_year": 1914,
      "end_year": 2030,
      "art": "도시의 밤과 위성 궤도 — 시로가 옥상에서 도시를 내려다본다",
      "day": [
        "#ECE8F4",
        "#DED8EE"
      ],
      "day_blob": [
        "rgba(155,138,216,.45)",
        "rgba(110,91,168,.3)"
      ],
      "night": [
        "#221C33",
        "#1C1724"
      ],
      "night_blob": [
        "rgba(110,91,168,.6)",
        "rgba(74,106,156,.35)"
      ],
      "diorama": "art/contemporary.svg",
      "scenes": [
        {
          "id": "contemporary-radio",
          "label": "라디오와 비행기",
          "start_year": 1914,
          "diorama": "art/contemporary-radio.svg",
          "art": "복엽기와 전파탑 — 시로가 라디오에 귀를 기울인다"
        },
        {
          "id": "contemporary-mondrian",
          "label": "빨강 파랑 노랑",
          "start_year": 1930,
          "diorama": "art/homage-mondrian.svg",
          "art": "검은 선과 빨강·파랑·노랑 면을 칠하는 토끼들",
          "after": "피트 몬드리안, 「빨강, 파랑, 노랑의 구성」, 1930"
        },
        {
          "id": "contemporary-city",
          "label": "도시와 위성",
          "start_year": 1960,
          "diorama": "art/contemporary.svg",
          "art": "도시의 밤과 위성 궤도 — 시로가 옥상에서 도시를 내려다본다"
        }
      ],
      "strip": "#6E5BA8"
    }
  ],
  "tracks": [
    {
      "id": "nation",
      "label": "왕조·국가사",
      "order": 1
    },
    {
      "id": "theme",
      "label": "주제사",
      "order": 2
    }
  ],
  "datasets": [
    {
      "id": "world",
      "file": "world-empire.json",
      "track": "nation",
      "category": "왕조사",
      "subcategory": "세계",
      "label": "세계사(제국·문명)",
      "color": "#7fa6cf",
      "region": "세계",
      "order": 10
    },
    {
      "id": "korea",
      "file": "korea-dynasty.json",
      "track": "nation",
      "category": "왕조사",
      "subcategory": "한국",
      "label": "한국사",
      "color": "#d99a92",
      "region": "동아시아",
      "order": 30,
      "periods": [
        {
          "label": "고조선",
          "start_year": -2333,
          "end_year": -108,
          "note": "단군 건국 전승(기원전 2333년)부터 위만조선 멸망(기원전 108년)까지 — 백과사전 「고조선」·「위만조선」"
        },
        {
          "label": "여러 나라",
          "start_year": -108,
          "end_year": 300,
          "note": "고조선 멸망 뒤 부여·고구려·옥저·동예·삼한이 자라던 때. 끝은 삼국이 고대 국가로 자리 잡는 300년 무렵 — 백과사전 「원삼국시대」(서기전 100~서기 300년경)"
        },
        {
          "label": "삼국 시대",
          "start_year": 300,
          "end_year": 676,
          "note": "끝은 나당전쟁이 끝난 676년 — 백과사전 「삼국시대」·「나당전쟁」"
        },
        {
          "label": "남북국 시대",
          "start_year": 676,
          "end_year": 900,
          "note": "통일신라와 발해(698~926). 끝은 후삼국 시대가 시작되는 900년 — 백과사전 「남북국시대」·「후삼국시대」"
        },
        {
          "label": "후삼국 시대",
          "start_year": 900,
          "end_year": 936,